{
  "schema": "loop-final-status-v1",
  "timestamp": "2025-10-01T18:45:41.5474861-07:00",
  "iterations": 3,
  "diffs": 0,
  "errors": 3,
  "succeeded": false,
  "averageSeconds": 0.027,
  "totalSeconds": 0.101,
  "percentiles": {
    "p50": 0.009,
    "p90": 0.053,
    "p99": 0.063
  },
  "histogram": null,
  "diffSummaryEmitted": false,
  "basePath": "C:\\dev\\compare-vi-cli-action\\Base.vi",
  "headPath": "C:\\dev\\compare-vi-cli-action\\Head.vi"
}
